{
  "region": { "id": "vancouver", "label": "Vancouver, BC" },
  "hazard": "wildfire",
  "assessment": {
    "score": 72,
    "level": "high",
    "factors": [
      { "key": "temperature", "label": "Temperature", "value": 29, "unit": "celsius", "contribution": 38 },
      { "key": "wind_speed", "label": "Wind speed", "value": 38, "unit": "km/h", "contribution": 34 }
    ]
  },
  "audience": "emergency_manager",
  "language": "en-CA"
}
